{
  "settings": {
    "jira_base_url": "https://jira.example.com/",
    "jira_api_version": "2",
    "jira_api_token": "",
    "mongo_uri": "mongodb://localhost:27017",
    "mongo_db": "valueStream",
    "customer_jql_new": "",
    "customer_jql_in_progress": "",
    "customer_jql_noop": "",
    "fiscal_year_start_month": 1,
    "sprint_duration_days": 14
  },
  "customers": [
    {
      "id": "c1",
      "name": "Customer Alpha",
      "existing_tcv": 15000,
      "existing_tcv_valid_from": "2026-01-01",
      "potential_tcv": 42000,
      "tcv_history": [
        { "id": "h1_c1", "value": 10000, "valid_from": "2025-01-01" }
      ]
    },
    {
      "id": "c2",
      "name": "Customer Beta",
      "existing_tcv": 300000,
      "existing_tcv_valid_from": "2026-01-01",
      "potential_tcv": 850000
    },
    {
      "id": "c3",
      "name": "Customer Gamma",
      "existing_tcv": 0,
      "existing_tcv_valid_from": "2026-01-01",
      "potential_tcv": 48000
    },
    {
      "id": "c4",
      "name": "Customer Delta",
      "existing_tcv": 50000,
      "existing_tcv_valid_from": "2026-01-01",
      "potential_tcv": 175000
    },
    {
      "id": "c5",
      "name": "Customer Epsilon",
      "existing_tcv": 0,
      "existing_tcv_valid_from": "2026-01-01",
      "potential_tcv": 240000
    },
    {
      "id": "c6",
      "name": "Customer Zeta",
      "existing_tcv": 0,
      "existing_tcv_valid_from": "2026-01-01",
      "potential_tcv": 380000
    },
    {
      "id": "c7",
      "name": "Customer Eta",
      "existing_tcv": 120000,
      "existing_tcv_valid_from": "2026-01-01",
      "potential_tcv": 155000
    },
    {
      "id": "c8",
      "name": "Customer Theta",
      "existing_tcv": 450000,
      "existing_tcv_valid_from": "2026-01-01",
      "potential_tcv": 920000
    },
    {
      "id": "c9",
      "name": "Customer Iota",
      "existing_tcv": 0,
      "existing_tcv_valid_from": "2026-01-01",
      "potential_tcv": 75000
    },
    {
      "id": "c10",
      "name": "Customer Kappa",
      "existing_tcv": 0,
      "existing_tcv_valid_from": "2026-01-01",
      "potential_tcv": 70000
    },
    {
      "id": "c11",
      "name": "Customer Lambda",
      "existing_tcv": 0,
      "existing_tcv_valid_from": "2026-01-01",
      "potential_tcv": 450000
    },
    {
      "id": "c12",
      "name": "Customer Mu",
      "existing_tcv": 0,
      "existing_tcv_valid_from": "2026-01-01",
      "potential_tcv": 520000
    },
    {
      "id": "c13",
      "name": "Customer Nur",
      "existing_tcv": 2000000,
      "existing_tcv_valid_from": "2026-01-01",
      "potential_tcv": 5100000,
      "tcv_history": [
        { "id": "h1_c13", "value": 1500000, "valid_from": "2025-06-01" },
        { "id": "h2_c13", "value": 800000, "valid_from": "2024-01-01" }
      ]
    },
    {
      "id": "c15",
      "name": "Customer Omicron",
      "existing_tcv": 0,
      "existing_tcv_valid_from": "2026-01-01",
      "potential_tcv": 125000
    },
    {
      "id": "c16",
      "name": "Customer Pi",
      "existing_tcv": 0,
      "existing_tcv_valid_from": "2026-01-01",
      "potential_tcv": 220000
    },
    {
      "id": "c17",
      "name": "Customer Rho",
      "existing_tcv": 0,
      "existing_tcv_valid_from": "2026-01-01",
      "potential_tcv": 130000
    },
    {
      "id": "c18",
      "name": "Customer Sigma",
      "existing_tcv": 0,
      "existing_tcv_valid_from": "2026-01-01",
      "potential_tcv": 72000
    },
    {
      "id": "c19",
      "name": "Customer Tau",
      "existing_tcv": 0,
      "existing_tcv_valid_from": "2026-01-01",
      "potential_tcv": 340000
    },
    {
      "id": "c20",
      "name": "Customer Upsilon",
      "existing_tcv": 0,
      "existing_tcv_valid_from": "2026-01-01",
      "potential_tcv": 160000
    },
    {
      "id": "c21",
      "name": "Customer Phi",
      "existing_tcv": 0,
      "existing_tcv_valid_from": "2026-01-01",
      "potential_tcv": 1250000
    },
    {
      "id": "c22",
      "name": "Customer Chi",
      "existing_tcv": 0,
      "existing_tcv_valid_from": "2026-01-01",
      "potential_tcv": 52000
    },
    {
      "id": "c23",
      "name": "Customer Psi",
      "existing_tcv": 0,
      "existing_tcv_valid_from": "2026-01-01",
      "potential_tcv": 47000
    },
    {
      "id": "c24",
      "name": "Customer Omega",
      "existing_tcv": 0,
      "existing_tcv_valid_from": "2026-01-01",
      "potential_tcv": 44000
    },
    {
      "id": "c25",
      "name": "Customer Prime",
      "existing_tcv": 0,
      "existing_tcv_valid_from": "2026-01-01",
      "potential_tcv": 65000
    },
    {
      "id": "c26",
      "name": "Customer Nexus",
      "existing_tcv": 0,
      "existing_tcv_valid_from": "2026-01-01",
      "potential_tcv": 145000
    },
    {
      "id": "c27",
      "name": "Customer Vertex",
      "existing_tcv": 0,
      "existing_tcv_valid_from": "2026-01-01",
      "potential_tcv": 260000
    },
    {
      "id": "c28",
      "name": "Customer Apex",
      "existing_tcv": 0,
      "existing_tcv_valid_from": "2026-01-01",
      "potential_tcv": 0
    },
    {
      "id": "c29",
      "name": "Customer Zenith",
      "existing_tcv": 0,
      "existing_tcv_valid_from": "2026-01-01",
      "potential_tcv": 550000
    },
    {
      "id": "c30",
      "name": "Customer Horizon",
      "existing_tcv": 0,
      "existing_tcv_valid_from": "2026-01-01",
      "potential_tcv": 0
    },
    {
      "id": "c31",
      "name": "Customer Meridian",
      "existing_tcv": 0,
      "existing_tcv_valid_from": "2026-01-01",
      "potential_tcv": 22000
    },
    {
      "id": "c1771841994567",
      "name": "Customer Quantum",
      "existing_tcv": 0,
      "existing_tcv_valid_from": "2026-01-01",
      "potential_tcv": 175000
    },
    {
      "id": "c1771842267185",
      "name": "Customer Test",
      "existing_tcv": 0,
      "existing_tcv_valid_from": "2026-01-01",
      "potential_tcv": 150
    },
    {
      "id": "c1772100453672",
      "name": "Customer Stellar",
      "existing_tcv": 0,
      "existing_tcv_valid_from": "2026-01-01",
      "potential_tcv": 48000
    }
  ],
  "workItems": [
    {
      "id": "f_global_maint",
      "name": "Global Infrastructure Maintenance",
      "total_effort_mds": 20,
      "all_customers_target": {
        "tcv_type": "existing",
        "priority": "Must-have"
      },
      "customer_targets": [],
      "released_in_sprint_id": "s4",
      "score": 146750
    },
    {
      "id": "f1",
      "name": "Multi-Site Support Enhancement",
      "total_effort_mds": 0,
      "release_link": "https://github.com/releases/v1.1.0",
      "customer_targets": [
        {
          "customer_id": "c27",
          "tcv_type": "potential"
        },
        {
          "customer_id": "c28",
          "tcv_type": "potential"
        },
        {
          "customer_id": "c2",
          "tcv_type": "potential"
        },
        {
          "customer_id": "c13",
          "tcv_type": "existing",
          "priority": "Must-have",
          "tcv_history_id": "h1_c13"
        }
      ],
      "score": 7090.909090909091
    },
    {
      "id": "f2",
      "name": "Automated Recovery Process",
      "total_effort_mds": 0,
      "release_link": "https://github.com/releases/v1.2.0",
      "customer_targets": [
        {
          "customer_id": "c29",
          "tcv_type": "potential"
        },
        {
          "customer_id": "c8",
          "tcv_type": "potential"
        },
        {
          "customer_id": "c30",
          "tcv_type": "potential"
        },
        {
          "customer_id": "c31",
          "tcv_type": "potential"
        },
        {
          "customer_id": "c1771841994567",
          "tcv_type": "potential",
          "priority": "Must-have"
        }
      ],
      "released_in_sprint_id": "s14",
      "score": 15154.545454545454
    },
    {
      "id": "f3",
      "name": "VM Migration After Failover",
      "total_effort_mds": 0,
      "customer_targets": [
        {
          "customer_id": "c11",
          "tcv_type": "potential",
          "priority": "Must-have"
        },
        {
          "customer_id": "c28",
          "tcv_type": "potential",
          "priority": "Must-have"
        },
        {
          "customer_id": "c27",
          "tcv_type": "potential",
          "priority": "Must-have"
        },
        {
          "customer_id": "c1772100453672",
          "tcv_type": "potential",
          "priority": "Should-have"
        },
        {
          "customer_id": "c2",
          "tcv_type": "potential",
          "priority": "Should-have"
        }
      ],
      "score": 9514.792899408283
    },
    {
      "id": "f4",
      "name": "Raw Device Mapping Support",
      "total_effort_mds": 0,
      "customer_targets": [],
      "score": 0
    },
    {
      "id": "f5",
      "name": "Failover Alignment",
      "total_effort_mds": 0,
      "customer_targets": [],
      "score": 0
    },
    {
      "id": "f6",
      "name": "Non-Disruptive Upgrades",
      "total_effort_mds": 0,
      "customer_targets": [],
      "score": 0
    },
    {
      "id": "f7",
      "name": "Source VM Power Management",
      "total_effort_mds": 0,
      "customer_targets": [
        {
          "customer_id": "c6",
          "tcv_type": "potential",
          "priority": "Must-have"
        }
      ],
      "score": 14615.384615384615
    },
    {
      "id": "f8",
      "name": "UI Enhancements",
      "total_effort_mds": 0,
      "customer_targets": [],
      "score": 0
    },
    {
      "id": "f9",
      "name": "Async Volume Protection",
      "total_effort_mds": 0,
      "customer_targets": [],
      "score": 0
    },
    {
      "id": "f10",
      "name": "Scalability Improvements",
      "total_effort_mds": 0,
      "customer_targets": [],
      "score": 0
    },
    {
      "id": "f11",
      "name": "Fan-out Recovery",
      "total_effort_mds": 0,
      "customer_targets": [],